{
  "schema_version": "release-deployment-subject.v1",
  "tenant_id": "tenant-example",
  "environment": "production",
  "release_id": "release-2026-07-11",
  "deployment_revision": 42,
  "source_repository": "https://example.invalid/hallu-defense",
  "source_commit": "aaaaaaaaaaaaaaaaaaaaaaaaaaaaaaaaaaaaaaaa",
  "workflow_ref": "release.yml@refs/heads/main",
  "workflow_sha256": "9999999999999999999999999999999999999999999999999999999999999999",
  "encryption_policy_sha256": "bbbbbbbbbbbbbbbbbbbbbbbbbbbbbbbbbbbbbbbbbbbbbbbbbbbbbbbbbbbbbbbb",
  "trust_store_sha256": "cccccccccccccccccccccccccccccccccccccccccccccccccccccccccccccccc",
  "postgres_tls": {
    "secret_resource_uid": "postgres-ca-uid-0001",
    "secret_name": "postgres-client-ca",
    "ca_key": "ca.crt",
    "bundle_sha256": "1111111111111111111111111111111111111111111111111111111111111111",
    "mount_path": "/var/run/secrets/hallu-defense/postgres/ca.crt",
    "sub_path": true,
    "rollout_revision": 42,
    "rollout_sha256": "ffffffffffffffffffffffffffffffffffffffffffffffffffffffffffffffff"
  },
  "artifacts": [
    {
      "name": "api",
      "image_digest": "sha256:dddddddddddddddddddddddddddddddddddddddddddddddddddddddddddddddd",
      "configuration_sha256": "eeeeeeeeeeeeeeeeeeeeeeeeeeeeeeeeeeeeeeeeeeeeeeeeeeeeeeeeeeeeeeee"
    }
  ]
}
